{
    "id": "CustomDataConnector",
    "name": "CustomDataConnector",
    "apiVersion": "2022-09-01-preview",
    "type": "Microsoft.SecurityInsights/dataConnectorDefinitions",
    "kind": "Customizable",
    "location": "{{location}}",
    "properties": {
        "connectorUiConfig": {
            "id": "CustomDataConnector",
            "title": "Custom Data Connector",
            "publisher": "Microsoft",
            "descriptionMarkdown": "# **New** Custom Data Connector",
            "graphQueriesTableName": "CustomDataTable",
            "graphQueries": [
                {
                    "metricName": "Events recieved",
                    "legend": "Custom data events recieved",
                    "baseQuery": "CustomDataTable | top 10"
                }
            ],
            "dataTypes": [
                {
                    "name": "CustomDataType",
                    "lastDataReceivedQuery": "CustomDataTable | summarize by count()"
                }
            ],
            "sampleQueries": [
                {
                    "query": "CustomDataTable | sort by TimeGenerated desc"
                }
            ],
            "connectivityCriteria": [
                {
                    "type": "HasDataConnectors"
                }
            ],
            "permissions": {
                "resourceProvider": [
                    {
                        "provider": "Microsoft.OperationalInsights/workspaces",
                        "permissionsDisplayText": "Read and Write permissions are required.",
                        "providerDisplayName": "Workspace",
                        "scope": "Workspace",
                        "requiredPermissions": {
                            "write": true,
                            "read": true,
                            "delete": true
                        }
                    }
                ],
                "customs": [
                    {
                        "name": "Custom Data Provider credentials",
                        "description": "API Key for Custom Data Provider required"
                    }
                ]
            },
            "instructions": [
                {
                    "title": "Connect CustomDataProvider to start collecting event logs to Sentinel",
                    "description": "Provide the required values below",
                    "instructions": [
                        {
                            "type": "Textbox",
                            "parameters": {
                                "label": "API Key",
                                "type": "text",
                                "name": "apiKey"
                            }
                        },
                        {
                            "type": "OAuthForm",
                            "parameters": {
                                "clientIdLabel": "Client ID",
                                "clientSecretLabel": "Client Secret",
                                "connectButtonLabel": "Connect",
                                "disconnectButtonLabel": "Disconnect"
                            }
                        }
                    ]
                }
            ]
        }
    }
}